{
  "$schema": "https://json-schema.org/draft/2020-12/schema",
  "$id": "https://schema.oasp.dev/v1alpha1/AgentDefinition.json",
  "title": "AgentDefinition",
  "type": "object",
  "properties": {
    "id": {
      "type": "string",
      "minLength": 1,
      "description": "Unique identifier of this AgentDefinition."
    },
    "name": {
      "type": "string",
      "minLength": 1,
      "description": "Human-readable name of the agent."
    },
    "instructions": {
      "type": "string",
      "description": "The agent's system prompt / instructions, verbatim."
    },
    "provider": {
      "description": "The provider this Definition targets when deployed.",
      "$ref": "#/$defs/Provider"
    },
    "model": {
      "type": "string",
      "minLength": 1,
      "description": "The provider's model identifier (e.g. a Claude model name)."
    },
    "tools": {
      "type": "array",
      "items": {
        "oneOf": [
          {
            "type": "object",
            "properties": {
              "type": {
                "type": "string",
                "const": "builtin_toolset",
                "description": "Discriminant identifying this as a builtin toolset grant."
              },
              "toolset": {
                "type": "string",
                "enum": [
                  "coding",
                  "search",
                  "files"
                ],
                "description": "Which provider-hosted builtin toolset is granted to the agent."
              }
            },
            "required": [
              "type",
              "toolset"
            ],
            "additionalProperties": false,
            "description": "Grants one of the provider-hosted builtin toolsets (coding, search, files)."
          },
          {
            "type": "object",
            "properties": {
              "type": {
                "type": "string",
                "const": "custom",
                "description": "Discriminant identifying this as a custom tool definition."
              },
              "name": {
                "type": "string",
                "minLength": 1,
                "description": "Unique name of the custom tool, as the model will call it."
              },
              "description": {
                "type": "string",
                "minLength": 1,
                "description": "Description of the custom tool shown to the model to guide when and how it is invoked."
              },
              "inputSchema": {
                "type": "object",
                "propertyNames": {
                  "type": "string"
                },
                "additionalProperties": {},
                "description": "JSON Schema (as a plain object) describing the custom tool's input shape."
              }
            },
            "required": [
              "type",
              "name",
              "description",
              "inputSchema"
            ],
            "additionalProperties": false,
            "description": "Defines a custom, non-MCP tool the agent may call."
          },
          {
            "type": "object",
            "properties": {
              "type": {
                "type": "string",
                "const": "mcp",
                "description": "Discriminant identifying this as an MCP server grant."
              },
              "serverUrl": {
                "type": "string",
                "format": "uri",
                "description": "URL of the MCP server exposing the tool(s)."
              },
              "label": {
                "type": "string",
                "minLength": 1,
                "description": "Human-readable label for this MCP server in tool pickers and logs."
              },
              "auth": {
                "type": "string",
                "enum": [
                  "none",
                  "credential"
                ],
                "description": "Whether this MCP server requires no authentication, or is matched to a Credential by serverUrl at session creation."
              },
              "permissionPolicy": {
                "type": "string",
                "enum": [
                  "always_allow",
                  "always_ask"
                ],
                "description": "Whether tool calls to this server run without confirmation, or require per-call approval."
              },
              "toolAllowlist": {
                "description": "If present, restricts usable tools on this server to this list; if absent, every tool the server exposes is usable.",
                "type": "array",
                "items": {
                  "type": "string",
                  "minLength": 1
                }
              }
            },
            "required": [
              "type",
              "serverUrl",
              "label",
              "auth",
              "permissionPolicy"
            ],
            "additionalProperties": false,
            "description": "Grants access to tools exposed by a remote MCP server, matched to a Credential by serverUrl at session creation."
          }
        ]
      },
      "description": "The tools available to the agent: builtin toolsets, custom tools, or MCP server grants."
    },
    "guardrails": {
      "type": "array",
      "items": {
        "type": "string",
        "minLength": 1
      },
      "description": "Opaque v0 guardrail identifiers/policy names applied to the agent. Structure beyond a name is left to profiles until two implementations interoperate on guardrail internals."
    },
    "draftVersion": {
      "type": "integer",
      "exclusiveMinimum": 0,
      "maximum": 9007199254740991,
      "description": "The draft head version number. Every edit to the Definition advances this."
    },
    "publishedVersion": {
      "anyOf": [
        {
          "type": "integer",
          "exclusiveMinimum": 0,
          "maximum": 9007199254740991
        },
        {
          "type": "null"
        }
      ],
      "description": "The version number live conversations pin to. Null if this Definition has never been published; otherwise only advanced by the explicit publish interaction."
    },
    "scope": {
      "description": "The generalized-ownership attachment point this Definition belongs to.",
      "$ref": "#/$defs/Scope"
    }
  },
  "required": [
    "id",
    "name",
    "instructions",
    "provider",
    "model",
    "tools",
    "guardrails",
    "draftVersion",
    "publishedVersion",
    "scope"
  ],
  "additionalProperties": false,
  "description": "The canonical, provider-neutral definition of an agent.",
  "$defs": {
    "Provider": {
      "type": "string",
      "enum": [
        "anthropic",
        "openai",
        "google"
      ],
      "description": "Agent-hosting provider. `anthropic` is the reference adapter; `openai` and `google` are reserved by name for future adapters."
    },
    "Scope": {
      "type": "object",
      "properties": {
        "level": {
          "type": "string",
          "enum": [
            "tenant",
            "workspace",
            "user",
            "group",
            "role"
          ],
          "description": "Which level of the tenant/workspace/user/group/role taxonomy this attachment point is at."
        },
        "id": {
          "type": "string",
          "minLength": 1,
          "description": "Identifier of the scoped entity (the tenant id, workspace id, user id, group id, or role id)."
        }
      },
      "required": [
        "level",
        "id"
      ],
      "additionalProperties": false,
      "description": "A generalized-ownership attachment point: a taxonomy level plus the identifier at that level."
    }
  }
}
